{
  "approval_ref": {
    "hash": "487f2cfd38efde248e364c5c09023d4a4f9a475cf86a5c27e8e1d96475560bd8",
    "id": "AUT-APR-20260728090006859-04126c",
    "path": ".sdlc/autonomy/approvals/AUT-APR-20260728090006859-04126c.json"
  },
  "authority_assurance": {
    "mode": "audit_only",
    "receipt_ref": null,
    "source": "declared_cli_attribution",
    "verified": false
  },
  "checkpoints": [
    "deploy.remote",
    "pull_request.merge"
  ],
  "constraints": {
    "allowed_capabilities": [
      "code-review",
      "gh",
      "git",
      "knowledge-base",
      "node",
      "npm",
      "repo-read",
      "repo-write",
      "rg",
      "test-runner"
    ],
    "allowed_environments": [
      "pull_request"
    ],
    "allowed_tools": [
      "code-review",
      "gh",
      "git",
      "knowledge-base",
      "node",
      "npm",
      "repo-read",
      "repo-write",
      "rg",
      "test-runner"
    ],
    "allowed_write_paths": [
      ".gitattributes",
      ".github/workflows",
      ".sdlc",
      "bin",
      "docs",
      "lib",
      "package.json",
      "scripts",
      "test",
      "ui"
    ],
    "budget_ref": null,
    "forbidden_actions": [
      "budget-extension",
      "destructive-action",
      "environment-change",
      "external-access",
      "external-publication",
      "gate-bypass",
      "global-install",
      "irreversible-migration",
      "new-tool-or-capability",
      "new-write-path",
      "production-access",
      "protected-branch-merge",
      "remote-deploy",
      "requirement-change",
      "scope-expansion",
      "secret-access",
      "security-privacy-compliance-decision"
    ]
  },
  "contract_refs": [
    {
      "hash": "86889f4f8ce0d871c7eedb5d9da772ad227c8549e24760bbcded79b68c653ded",
      "id": "contract-ST-PORTABLE-WORKFLOW-HARDENING-implementation",
      "path": ".sdlc/contracts/contract-ST-PORTABLE-WORKFLOW-HARDENING-implementation.json"
    }
  ],
  "created_at": "2026-07-28T08:59:58.703Z",
  "delivery_id": "PR-PORTABLE-WORKFLOW-HARDENING-001",
  "delivery_kind": "pull_request",
  "expires_at": null,
  "extensions": {
    "approved_profile_hash": "ecd768fafc3c9460d636dda82b0d47441c50ae92d3cdaf2b814f8626ca6ee34f",
    "exact_delivery_selection": true,
    "requirement_ids": [
      "REQ-ENTERPRISE-CONTROL-PLANE-001-R2"
    ]
  },
  "hash_algorithm": "sha256:stable-json:v1",
  "id": "AUT-PR-PORTABLE-WORKFLOW-HARDENING-001",
  "kind": "delivery_execution_profile",
  "local_release_target": null,
  "material_scope": {
    "acceptance_criteria": [],
    "budget": null,
    "capabilities": [
      "code-review",
      "gh",
      "git",
      "knowledge-base",
      "node",
      "npm",
      "repo-read",
      "repo-write",
      "rg",
      "test-runner"
    ],
    "environment": [
      "pull_request"
    ],
    "external_or_production_access": {
      "destructive": false,
      "external": false,
      "production": false
    },
    "objective": "Implement story-scoped changes on dedicated branches using the approved contract, tests, and knowledge base context.",
    "release_target": {
      "allowed_actions": [
        "git.commit",
        "git.push",
        "pull_request.create",
        "pull_request.merge",
        "pull_request.update",
        "repository.read",
        "repository.write",
        "test.run"
      ],
      "base_branch": "main",
      "head_branch": "codex/ST-PORTABLE-WORKFLOW-HARDENING",
      "merge_allowed": true,
      "repository": "github.com/aantenore/agentic-sdlc-codex-plugin"
    },
    "scope": {
      "contract_id": "contract-ST-PORTABLE-WORKFLOW-HARDENING-implementation",
      "delivery_id": "PR-PORTABLE-WORKFLOW-HARDENING-001",
      "delivery_profile_id": "AUT-PR-PORTABLE-WORKFLOW-HARDENING-001",
      "requirement_profile_ids": [
        "AUT-REQ-ENTERPRISE-CONTROL-PLANE-001-R2-R2"
      ],
      "story_id": "ST-PORTABLE-WORKFLOW-HARDENING"
    },
    "write_paths": [
      ".gitattributes",
      ".github/workflows",
      ".sdlc",
      "bin",
      "docs",
      "lib",
      "package.json",
      "scripts",
      "test",
      "ui"
    ]
  },
  "material_scope_hash": "efa69803736d91a48d6edebd5067b49848ca4c1d70ae04995da5096d2863d47f",
  "phase_levels": {},
  "profile_hash": "05b196c3abd118b84aaee3a8dbd89125df5fe243b06ebb9dd7bc006f51ba7445",
  "provider_bindings": [
    {
      "action": "git.push",
      "provider_id": "git-remote"
    },
    {
      "action": "pull_request.create",
      "provider_id": "github-cli"
    },
    {
      "action": "pull_request.merge",
      "provider_id": "github-cli"
    },
    {
      "action": "pull_request.update",
      "provider_id": "github-cli"
    }
  ],
  "provider_bindings_hash": "359b42acd6e3d022ade2626fb386d564e4993541f0809a5d6f0feb61fda50fe7",
  "pull_request_target": {
    "allowed_actions": [
      "git.commit",
      "git.push",
      "pull_request.create",
      "pull_request.merge",
      "pull_request.update",
      "repository.read",
      "repository.write",
      "test.run"
    ],
    "base_branch": "main",
    "head_branch": "codex/ST-PORTABLE-WORKFLOW-HARDENING",
    "merge_allowed": true,
    "repository": "github.com/aantenore/agentic-sdlc-codex-plugin"
  },
  "requested_level": "bounded-autonomous",
  "requirement_profile_refs": [
    {
      "hash": "d37ffd6335013c26c1369858466045b452a28e6ed9b1d647fdd5532b5bc40c84",
      "id": "AUT-REQ-ENTERPRISE-CONTROL-PLANE-001-R2-R2",
      "path": ".sdlc/autonomy/requirements/AUT-REQ-ENTERPRISE-CONTROL-PLANE-001-R2-R2.json"
    }
  ],
  "schema_version": "delivery-execution-profile:v2",
  "status": "active",
  "story_refs": [
    {
      "hash": "13f63c36850a914958c7c4dfb912d08a2f967e254604ac7b1571d8cd32408bef",
      "id": "ST-PORTABLE-WORKFLOW-HARDENING",
      "path": ".sdlc/stories/ST-PORTABLE-WORKFLOW-HARDENING/story.json"
    }
  ],
  "updated_at": "2026-07-28T09:00:06.860Z",
  "use_policy": {
    "close_on_terminal": true,
    "max_concurrent_runs": 1,
    "mode": "exact-delivery",
    "require_usage_receipt": true,
    "reusable_across_deliveries": false
  },
  "valid_from": "2026-07-28T08:59:58.703Z",
  "version": 2
}
