{
  "approval_ref": {
    "hash": "8a70e0fdb1a059affa043c534238325ef3a5ce063967c3abc99b90712ea70e36",
    "id": "AUT-APR-20260719005220415-0ad8c1",
    "path": ".sdlc/autonomy/approvals/AUT-APR-20260719005220415-0ad8c1.json"
  },
  "authority_assurance": {
    "mode": "audit_only",
    "receipt_ref": null,
    "source": "declared_cli_attribution",
    "verified": false
  },
  "checkpoints": [
    "deploy.remote",
    "pull_request.merge"
  ],
  "constraints": {
    "allowed_capabilities": [
      "code-review",
      "gh",
      "git",
      "knowledge-base",
      "node",
      "npm",
      "repo-read",
      "repo-write",
      "test-runner"
    ],
    "allowed_environments": [
      "pull_request"
    ],
    "allowed_tools": [
      "code-review",
      "gh",
      "git",
      "knowledge-base",
      "node",
      "npm",
      "repo-read",
      "repo-write",
      "test-runner"
    ],
    "allowed_write_paths": [
      ".sdlc",
      "README.md",
      "bin",
      "docs",
      "lib",
      "scripts",
      "test",
      "ui"
    ],
    "budget_ref": null,
    "forbidden_actions": [
      "budget-extension",
      "destructive-action",
      "environment-change",
      "external-access",
      "external-publication",
      "gate-bypass",
      "global-install",
      "irreversible-migration",
      "new-tool-or-capability",
      "new-write-path",
      "production-access",
      "protected-branch-merge",
      "remote-deploy",
      "requirement-change",
      "scope-expansion",
      "secret-access",
      "security-privacy-compliance-decision"
    ]
  },
  "contract_refs": [
    {
      "hash": "528e8e0629fe2f89a28c2279945f27e1fa7c08b49e4db0397ad7ec6c73cd937f",
      "id": "contract-ST-ENT-PORTFOLIO-R2-implementation-v2",
      "path": ".sdlc/contracts/contract-ST-ENT-PORTFOLIO-R2-implementation-v2.json"
    }
  ],
  "created_at": "2026-07-19T00:52:14.678Z",
  "delivery_id": "PR-ENT-PORTFOLIO",
  "delivery_kind": "pull_request",
  "expires_at": null,
  "extensions": {
    "approved_profile_hash": "3313e743a5c10303822182c0b4f3c45024af6cc33734c6f1236a14e1e367042d",
    "exact_delivery_selection": true,
    "requirement_ids": [
      "REQ-ENT-PORTFOLIO"
    ]
  },
  "hash_algorithm": "sha256:stable-json:v1",
  "id": "AUT-PR-ENT-PORTFOLIO-R2",
  "kind": "delivery_execution_profile",
  "local_release_target": null,
  "material_scope": {
    "acceptance_criteria": [
      "An explicit manifest aggregates up to 64 projects in declared order without discovery and isolates unavailable roots.",
      "A lightweight bounded summary reports active workflows, blockers, risks, budgets, dependencies and releases and computes useful health.",
      "Full detail is loaded lazily, retained in a bounded observable LRU and disposed when the server closes.",
      "The compact portfolio status CLI returns stable JSON, terminates immediately and reveals no token or absolute project path.",
      "The web UI preserves project attribution during delayed navigation, supports URL history and has correct English/Italian accessible structure.",
      "Filesystem directory identities are exact above 2^53 and portable across Node.js 18, 20 and 24.",
      "All targeted, full-suite, static and performance checks pass before push and merge."
    ],
    "budget": null,
    "capabilities": [
      "code-review",
      "gh",
      "git",
      "knowledge-base",
      "node",
      "npm",
      "repo-read",
      "repo-write",
      "test-runner"
    ],
    "environment": [
      "pull_request"
    ],
    "external_or_production_access": {
      "destructive": false,
      "external": false,
      "production": false
    },
    "objective": "Implement story-scoped changes on dedicated branches using the approved contract, tests, and knowledge base context.",
    "release_target": {
      "allowed_actions": [
        "git.commit",
        "git.push",
        "pull_request.update",
        "repository.read",
        "repository.write",
        "test.run"
      ],
      "base_branch": "main",
      "head_branch": "codex/ST-ENT-PORTFOLIO",
      "merge_allowed": true,
      "repository": "github.com/aantenore/agentic-sdlc-codex-plugin"
    },
    "scope": {
      "contract_id": "contract-ST-ENT-PORTFOLIO-R2-implementation-v2",
      "delivery_id": "PR-ENT-PORTFOLIO",
      "delivery_profile_id": "AUT-PR-ENT-PORTFOLIO-R2",
      "requirement_profile_ids": [
        "AUT-REQ-ENT-PORTFOLIO-R1"
      ],
      "story_id": "ST-ENT-PORTFOLIO-R2"
    },
    "write_paths": [
      ".sdlc",
      "README.md",
      "bin",
      "docs",
      "lib",
      "scripts",
      "test",
      "ui"
    ]
  },
  "material_scope_hash": "fc93ecff78035c3612e8bbe05d5cce370d98b9c6ccc0e86ca0021ab9c9e14d84",
  "phase_levels": {},
  "profile_hash": "9bb4f27f08915b10443d8fc230e4281b00288053ea1ab36d1d14e37ae172e66b",
  "provider_bindings": [
    {
      "action": "git.push",
      "provider_id": "git-remote"
    },
    {
      "action": "pull_request.create",
      "provider_id": "github-cli"
    },
    {
      "action": "pull_request.merge",
      "provider_id": "github-cli"
    },
    {
      "action": "pull_request.update",
      "provider_id": "github-cli"
    }
  ],
  "provider_bindings_hash": "359b42acd6e3d022ade2626fb386d564e4993541f0809a5d6f0feb61fda50fe7",
  "pull_request_target": {
    "allowed_actions": [
      "git.commit",
      "git.push",
      "pull_request.update",
      "repository.read",
      "repository.write",
      "test.run"
    ],
    "base_branch": "main",
    "head_branch": "codex/ST-ENT-PORTFOLIO",
    "merge_allowed": true,
    "repository": "github.com/aantenore/agentic-sdlc-codex-plugin"
  },
  "requested_level": "bounded-autonomous",
  "requirement_profile_refs": [
    {
      "hash": "07d5927def7f94e60ef5932b0efd5b6d18fe532398922bbca655381f5ee24119",
      "id": "AUT-REQ-ENT-PORTFOLIO-R1",
      "path": ".sdlc/autonomy/requirements/AUT-REQ-ENT-PORTFOLIO-R1.json"
    }
  ],
  "schema_version": "delivery-execution-profile:v2",
  "status": "active",
  "story_refs": [
    {
      "hash": "af044257ce2de10b5e616b86c9e3d79b35559ab69a0f0b83594be8adcfb684d5",
      "id": "ST-ENT-PORTFOLIO-R2",
      "path": ".sdlc/stories/ST-ENT-PORTFOLIO-R2/story.json"
    }
  ],
  "updated_at": "2026-07-19T00:52:20.415Z",
  "use_policy": {
    "close_on_terminal": true,
    "max_concurrent_runs": 1,
    "mode": "exact-delivery",
    "require_usage_receipt": true,
    "reusable_across_deliveries": false
  },
  "valid_from": "2026-07-19T00:52:14.678Z",
  "version": 2
}
