{
  "approval_ref": {
    "hash": "058368907b9dc84655033db8c93c1011eeb0e9d0517d7758656313be620ada49",
    "id": "AUT-APR-20260719005039646-2ae671",
    "path": ".sdlc/autonomy/approvals/AUT-APR-20260719005039646-2ae671.json"
  },
  "authority_assurance": {
    "mode": "audit_only",
    "receipt_ref": null,
    "source": "declared_cli_attribution",
    "verified": false
  },
  "checkpoints": [
    "deploy.remote",
    "pull_request.merge"
  ],
  "constraints": {
    "allowed_capabilities": [
      "code-review",
      "gh",
      "git",
      "knowledge-base",
      "node",
      "npm",
      "repo-read",
      "repo-write",
      "test-runner"
    ],
    "allowed_environments": [
      "pull_request"
    ],
    "allowed_tools": [
      "code-review",
      "gh",
      "git",
      "knowledge-base",
      "node",
      "npm",
      "repo-read",
      "repo-write",
      "test-runner"
    ],
    "allowed_write_paths": [
      ".sdlc",
      "README.md",
      "bin",
      "docs",
      "lib",
      "scripts",
      "test",
      "ui"
    ],
    "budget_ref": null,
    "forbidden_actions": [
      "budget-extension",
      "destructive-action",
      "environment-change",
      "external-access",
      "external-publication",
      "gate-bypass",
      "global-install",
      "irreversible-migration",
      "new-tool-or-capability",
      "new-write-path",
      "production-access",
      "protected-branch-merge",
      "remote-deploy",
      "requirement-change",
      "scope-expansion",
      "secret-access",
      "security-privacy-compliance-decision"
    ]
  },
  "contract_refs": [
    {
      "hash": "1063e61eae49e4b3e30bb5ebabea2d7c0ac18e5886937a8ce1cf3b2ebbc827fc",
      "id": "contract-ST-ENT-PORTFOLIO-R2-implementation",
      "path": ".sdlc/contracts/contract-ST-ENT-PORTFOLIO-R2-implementation.json"
    }
  ],
  "created_at": "2026-07-19T00:50:32.731Z",
  "delivery_id": "PR-ENT-PORTFOLIO",
  "delivery_kind": "pull_request",
  "expires_at": null,
  "extensions": {
    "approved_profile_hash": "eea80bdbb2f77d9a0f9c0ea48d08188257b18d4fcfde3e20054822d09a535bb5",
    "exact_delivery_selection": true,
    "requirement_ids": [
      "REQ-ENT-PORTFOLIO"
    ]
  },
  "hash_algorithm": "sha256:stable-json:v1",
  "id": "AUT-PR-ENT-PORTFOLIO",
  "kind": "delivery_execution_profile",
  "local_release_target": null,
  "material_scope": {
    "acceptance_criteria": [],
    "budget": null,
    "capabilities": [
      "code-review",
      "gh",
      "git",
      "knowledge-base",
      "node",
      "npm",
      "repo-read",
      "repo-write",
      "test-runner"
    ],
    "environment": [
      "pull_request"
    ],
    "external_or_production_access": {
      "destructive": false,
      "external": false,
      "production": false
    },
    "objective": "Implement story-scoped changes on dedicated branches using the approved contract, tests, and knowledge base context.",
    "release_target": {
      "allowed_actions": [
        "git.commit",
        "git.push",
        "pull_request.update",
        "repository.read",
        "repository.write",
        "test.run"
      ],
      "base_branch": "main",
      "head_branch": "codex/ST-ENT-PORTFOLIO",
      "merge_allowed": true,
      "repository": "github.com/aantenore/agentic-sdlc-codex-plugin"
    },
    "scope": {
      "contract_id": "contract-ST-ENT-PORTFOLIO-R2-implementation",
      "delivery_id": "PR-ENT-PORTFOLIO",
      "delivery_profile_id": "AUT-PR-ENT-PORTFOLIO",
      "requirement_profile_ids": [
        "AUT-REQ-ENT-PORTFOLIO-R1"
      ],
      "story_id": "ST-ENT-PORTFOLIO-R2"
    },
    "write_paths": [
      ".sdlc",
      "README.md",
      "bin",
      "docs",
      "lib",
      "scripts",
      "test",
      "ui"
    ]
  },
  "material_scope_hash": "b910fbda3b4b4eb77cd885033be6299f2d76d808fa0cb23d4664d7ef69b143d2",
  "phase_levels": {},
  "profile_hash": "5e34ea4af54eb8d12d16c16451390c10f544e2350a1f8fb481c1ba9707bbb385",
  "provider_bindings": [
    {
      "action": "git.push",
      "provider_id": "git-remote"
    },
    {
      "action": "pull_request.create",
      "provider_id": "github-cli"
    },
    {
      "action": "pull_request.merge",
      "provider_id": "github-cli"
    },
    {
      "action": "pull_request.update",
      "provider_id": "github-cli"
    }
  ],
  "provider_bindings_hash": "359b42acd6e3d022ade2626fb386d564e4993541f0809a5d6f0feb61fda50fe7",
  "pull_request_target": {
    "allowed_actions": [
      "git.commit",
      "git.push",
      "pull_request.update",
      "repository.read",
      "repository.write",
      "test.run"
    ],
    "base_branch": "main",
    "head_branch": "codex/ST-ENT-PORTFOLIO",
    "merge_allowed": true,
    "repository": "github.com/aantenore/agentic-sdlc-codex-plugin"
  },
  "requested_level": "bounded-autonomous",
  "requirement_profile_refs": [
    {
      "hash": "07d5927def7f94e60ef5932b0efd5b6d18fe532398922bbca655381f5ee24119",
      "id": "AUT-REQ-ENT-PORTFOLIO-R1",
      "path": ".sdlc/autonomy/requirements/AUT-REQ-ENT-PORTFOLIO-R1.json"
    }
  ],
  "schema_version": "delivery-execution-profile:v2",
  "status": "active",
  "story_refs": [
    {
      "hash": "f6808332cf4f29f7566a32c416fe939bda41f12d5eb64a988e5ed7b8c1242a7e",
      "id": "ST-ENT-PORTFOLIO-R2",
      "path": ".sdlc/stories/ST-ENT-PORTFOLIO-R2/story.json"
    }
  ],
  "updated_at": "2026-07-19T00:50:39.652Z",
  "use_policy": {
    "close_on_terminal": true,
    "max_concurrent_runs": 1,
    "mode": "exact-delivery",
    "require_usage_receipt": true,
    "reusable_across_deliveries": false
  },
  "valid_from": "2026-07-19T00:50:32.731Z",
  "version": 2
}
